name,image_file_path,description
Sentiment Analysis,./pics/sentiment-analysys.png,"Unlock the power of customer opinions with our cutting-edge Sentiment Analysis service. Leverage Python NLP techniques to uncover valuable insights from diverse datasets."
Custom Chatbot AI,pics/chatbot.png,"Revolutionize your customer service with our tailor-made AI chatbots. Empower your business with intelligent and engaging bots that guide you every step of the way."
Text Summarization,pics/text_summerization.png,"Condense lengthy documents effortlessly with our Text Summarization service. Utilize NLP, Huggingface, and BERT models to grasp content quickly and efficiently."
Machine Translation,pics/machine-translation.png,"Bridge language barriers with our advanced Machine Translation services. Harness NLP techniques and Google's translation technology for seamless communication."
Information Extraction,./pics/token-classification.png,"Discover hidden gems in unstructured text with our Information Extraction solutions. Leverage NLP techniques and Huggingface models to extract valuable insights with ease."
Data Augmentation,./../pics/data-augmentation.png,"Enhance your datasets with our Data Augmentation services. Improve model performance by generating diverse and robust training data for machine learning applications."
Natural Language Processing,pics/nlp.png,"Automate understanding and manipulation of human language by machine. Unleash the power of NLP in numerous sectors including healthcare and customer service."
Image Recognition,pics/image_recognition.png,"Enable your applications to recognize, process and analyze images, and provide outputs based on the findings."
Speech Recognition,pics/speech_recognition.png,"Transform spoken language into written text, enabling voice control for various devices and systems."
Anomaly Detection,pics/anomaly_detection.png,"Identify unusual patterns and outliers in your data to prevent fraud, minimize risk, and optimize operational efficiency."
Predictive Analytics,pics/predictive_analytics.png,"Predict future outcomes based on historical data and analytics techniques. Useful in various fields including finance, healthcare, and marketing."
Time Series Forecasting,pics/time_series_forecasting.png,"Predict future values based on previously observed values. Particularly useful in finance, sales and inventory management."
Customer Segmentation,pics/customer_segmentation.png,"Classify customers into segments which improve strategies around marketing, customer retention, and sales growth."
Fraud Detection,pics/fraud_detection.png,"Identify deceptive actions within a business process that are not easily noticed, helping protect your organization from financial losses."
Recommendation Systems,pics/recommendation_systems.png,"Provide personalized recommendations to users based on their past behaviors, enhancing user experience and engagement."
Deep Learning,pics/deep_learning.png,"Deploy complex neural networks modeled after human brains to process large amount of data and extract meaningful insights."
Computer Vision,pics/computer_vision.png,"Equip your systems with the ability to perceive, understand, and analyze their surroundings using images and video."
Reinforcement Learning,pics/reinforcement_learning.png,"Train machine learning models to make a sequence of decisions with the goal of maximizing the total reward."
Transfer Learning,pics/transfer_learning.png,"Apply knowledge gained from one problem to a different but related problem, improving the efficiency of machine learning models."
Dimensionality Reduction,pics/dimensionality_reduction.png,"Reduce the number of random variables under consideration, simplifying models and speeding up machine learning algorithms."
Neural Networks,pics/neural_networks.png,"Deploy biologically inspired networks of artificial neurons, enabling complex problem-solving across various domains."
Association Rules,pics/association_rules.png,"Discover interesting relations between variables in large datasets, useful for decision-making processes."
Decision Trees,pics/decision_trees.png,"Apply a model of decisions and their possible consequences, ideal for business strategy and
